{
  "schema_version": "1.0.0",
  "id": "s020_seed_pipeline",
  "kind": "run_record",
  "goal_node": "goal_joint-polish",
  "question": "How rich is the candidate survivor set produced by the bracket-augmented filter pipeline (no LM polish) on seed 6, and where does truth land in it?",
  "hypothesis": "The filter pipeline retains a truth-/twin-rich survivor set on seed 6.",
  "status": "confirmed",
  "run_type": "expensive",
  "seeds": [6],
  "N": 1,
  "claim_scope": "N1",
  "metrics": {
    "n_candidates": 432000,
    "n_omega_cells": 1500,
    "n_survivors": 875,
    "min_q0_to_truth_survivors_deg": 35.84,
    "min_q0_to_truth_pool_deg": 2.26,
    "true_truth_basin_survivors": 0,
    "wall_s": 3684
  },
  "artefacts": [
    { "path": "results/s020/seed006/summary.json", "kind": "data" },
    { "path": "results/s020/seed006/survivor_lcs.npz", "kind": "checkpoint" },
    { "path": "results/s020/seed006/s020_funnel_seed006.html", "kind": "plot" }
  ],
  "writeup_refs": ["notebooks/inversion/survey/experiments/s020_seed_pipeline.md"],
  "parents": ["s019_ls_bracket_omega_mag", "s019b_omega_dir_basin_at_truth_mag", "s018a_bright_band_calibration", "s018b_face_identity_tiers", "s018c_phi_sweep_pilot"],
  "substrate_versions": { "propagator": "1.0.0", "surrogate": "v2", "scorer": "1.0.0" },
  "oracle_clean": false,
  "gates_failed": ["oracle-leak"],
  "created_at": "2026-05-04T00:00:00Z",
  "narrative_md": "First end-to-end filter pipeline on seed 6 (432k candidates x 1500 omega-cells, no LM): rejects 94% of candidates. Pipeline mechanics validated, but the strict 1.0/1.0 thresholds reject the 2 true truth-basin + 3 twin-basin candidates that exist in the IC pool (they score align <= 0.429 because 30deg phi-step granularity misses spec events). Diagnosis: thresholds too strict for IC granularity."
}
